{"iter": 1, "phase_targeted": "baseline", "hypothesis": "JAX-native phase machine w/ analytic-FK Jacobian IK reproduces a real grasp on 256 envs", "edit": "initial controller.py (APPROACH/DESCEND/GRASP/LIFT/HOLD) + harness.py", "metrics_before": null, "metrics_after": {"approach_ok": 1.0, "descend_ok": 0.9922, "grasp_ok": 0.9648, "lift_ok": 0.4531, "place_ok": 0.0117, "success_rate": 0.0, "reached_box_rate": 0.8555, "max_lift": 0.3703, "mean_max_box_target": 0.2098}, "verdict": "kept"}
{"iter": 2, "phase_targeted": "GRASP", "hypothesis": "full-close (fw->0) ejects the 4cm cube; commanding grasp_width~0.012-0.02 clamps without ejecting", "edit": "add grasp_width knob; sweep {0.010,0.014,0.018,0.022}", "metrics_before": {"lift_ok": 0.4531}, "metrics_after": {"lift_ok_w0.010": 0.4219, "lift_ok_w0.014": 0.3477, "lift_ok_w0.018": 0.0234, "lift_ok_w0.022": 0.0039}, "verdict": "reverted", "lesson": "WRONG hypothesis: wider width holds WORSE. fw=0 (hard squeeze) lifts best. Cube held by friction; firmest squeeze wins. grasp_width kept at 0."}
{"iter": 3, "phase_targeted": "LIFT", "hypothesis": "collapsing lift+transport into one diagonal yank shears the cube out; split into LIFT(straight up)->TRANSPORT(translate at height)->PLACE(lower)", "edit": "add TRANSPORT+PLACE phases; LIFT goes straight up on locked xy", "metrics_before": {"lift_ok": 0.4531, "place_ok": 0.0117}, "metrics_after": {"lift_ok": 0.6562, "place_ok": 0.0039}, "verdict": "kept", "lesson": "straight-up lift before lateral motion improved lift 0.45->0.66. But place still ~0; transport starts too late (t~108) and IK sags in z while translating."}
{"iter": 4, "phase_targeted": "TRANSPORT", "hypothesis": "transport starts too late + IK sags in z during far lateral moves; speed early phases (tighter timeouts) and boost IK (gain 0.6->1.0, iters 6->12, cart_step 0.05->0.06)", "edit": "ik_gain=1.0, ik_iters=12, cart_step=0.06, approach/descend_max=25, grasp_max=20, grasp_hold=8, lift_timeout=25", "metrics_before": {"lift_ok": 0.6562, "place_ok": 0.0039, "mean_max_box_target": 0.1943}, "metrics_after": {"lift_ok": 0.7891, "place_ok": 0.0508, "mean_max_box_target": 0.3323}, "verdict": "kept", "lesson": "faster IK + earlier transport: lift 0.66->0.79, place 0.004->0.05, mean_bt 0.19->0.33. Still success 0; transport still too slow/sags. reached_box 0.85->0.79 (slight grasp overshoot)."}
{"iter": 5, "phase_targeted": "PLACE", "hypothesis": "box reaches near-target then SAGS away because goal chases the live (sagging) box (feedback trap) and the position controller droops at extended reach; freeze grasp offset + command site to target + up_bias to counteract droop", "edit": "frozen grasp_off state; PLACE/HOLD goal = target + up_bias + frozen_off; sweep up_bias {0.04,0.08,0.12,0.16}, place_cart_step 0.06", "metrics_before": {"place_ok": 0.0117}, "metrics_after": {"place_ok_ub0.04": 0.4102, "place_ok_ub0.08": 0.2539, "mean_max_box_target_ub0.04": 0.3665}, "verdict": "kept", "lesson": "up_bias droop-compensation is a BIG lever: place_ok 0.01->0.41 at up_bias=0.04. But success still 0 -> the cap is elsewhere (rotation)."}
{"iter": 6, "phase_targeted": "ROTATION (box_target cap)", "hypothesis": "among envs that place the box within 2cm with reached_box latched, box_target still <0.9 because rot_err is large (cube twisted in grip). box_target = reached*(1-tanh(5*(0.9pos+0.1rot)))", "edit": "probe_rot.py: decompose box_target into pos/rot at closest-approach step", "metrics_before": null, "metrics_after": {"among_placed_pos_err_p50": 0.013, "rot_err_p50": 0.508, "box_target_p50": 0.693, "box_target_IF_rot0_p50": 0.940, "would_succeed_if_rot0": 101}, "verdict": "diagnosis", "lesson": "ROTATION IS THE WALL. Placement is accurate (pos p50 1.3cm) but rot_err p50=0.51 caps box_target at ~0.69. If rot_err=0, 101/256 would hit box_target>=0.9. Must keep the gripper level/yaw-fixed so the square cube stays axis-aligned (target quat=identity)."}
{"iter": 7, "phase_targeted": "ROTATION", "hypothesis": "iterative 6-DOF DLS orientation lock will hold the gripper level", "edit": "ik_step 6-DOF DLS with smooth so3 residual; phase-gated ori_w from GRASP", "metrics_before": {"success_rate": 0.0}, "metrics_after": {"best_mean_max_box_target": 0.10, "place_ok": 0.03}, "verdict": "reverted", "lesson": "DEAD-END: iterative orientation (full 6-DOF DLS AND nullspace projection) dynamically fights position during carry, wrecking placement (mean_bt 0.37->0.06, arm flings cube up to 1m). Orientation must be solved EXACTLY, not iteratively-traded."}
{"iter": 8, "phase_targeted": "ROTATION", "hypothesis": "ANALYTIC level-gripper IK (compute_franka_ik with q7 sweep, R_des=R_home) gives exact level pose -> rot_err~0", "edit": "aik_solve() + use_aik knob; dispatch from GRASP (aik_from=2); position-only IK pre-grasp", "metrics_before": {"success_rate": 0.0}, "metrics_after": {"success_rate": 0.0312, "place_ok": 0.168, "reached_box_rate": 0.79}, "verdict": "kept", "lesson": "CRACKED IT: analytic level-IK gives the first real successes (8/256). Engaging at GRASP (not LIFT/TRANSPORT) is essential - a level grasp from the start aligns the cube; engaging late jolts it out of level at placement. Remaining ceilings: reached_box ~0.80 (grasp precision) and lift_ok ~0.56 (leveling a marginal grasp slips it)."}
{"iter": 9, "phase_targeted": "LIFT", "hypothesis": "the analytic level-IK at GRASP reorients marginal grasps and slips them mid-air (lift_ok 0.56); a LONGER grasp-hold lets the cube SETTLE into the level grip on the table before lifting", "edit": "sweep grasp_hold_steps {18,22}, grasp_max 28, xy_tol 0.005 (tighter centering)", "metrics_before": {"success_rate": 0.0312, "lift_ok": 0.5664, "place_ok": 0.156, "reached_box_rate": 0.777}, "metrics_after": {"success_rate": 0.0586, "lift_ok": 0.586, "place_ok": 0.176, "reached_box_rate": 0.781, "mean_max_box_target": 0.297}, "verdict": "kept", "lesson": "grasp_hold_steps 8->18 ~DOUBLED success (0.03->0.06). Settling into the level grip before lift secures marginal grasps. grasp_hold=22 slightly worse (over-hold wastes the step budget). v9 = BEST."}
{"iter": 10, "phase_targeted": "verify", "hypothesis": "the batch successes are real picks, not metric artifacts", "edit": "render_batch_success.py: re-run the exact vmap split key as a single env and render", "metrics_before": null, "metrics_after": {"batch_successes": "12/256", "rendered": "HL_v9_SUCCESS_env6 (maxbt 0.915), env21 (maxbt 0.912)", "top_maxbt": [0.941,0.937,0.934]}, "verdict": "verified", "lesson": "VERIFIED: 12/256 batch envs cross box_target>=0.9; single-env replay of the exact key reproduces the success (maxbt>0.9) and renders a clean grasp+lift+place to the elevated target. Videos on EC2."}
{"iter": 2, "phase_targeted": "place/grasp-settle", "hypothesis": "reached_box caps at 0.77; among reached near-miss envs box_target~0.8-0.88 capped ~equally by pos_err(p50 17mm) and rot_err(p50 0.18); cube tilts in grasp. Longer grasp-hold + tighter xy lets cube settle flat -> lower rot_err -> more crossings of 0.9", "edit": "knobs grasp_hold_steps 18->40, grasp_max ->40, xy_tol 0.01->0.006, full close (width 0)", "metrics_before": {"success_rate": 0.0625, "lift_ok": 0.62, "place_ok": 0.23}, "metrics_after": {"success_rate": 0.0977, "grasp_ok": 0.9844, "lift_ok": 0.6914, "place_ok": 0.2578, "reached_box_rate": 0.7773, "mean_max_box_target": 0.3838}, "verdict": "kept (r_hold best)"}
{"iter": "B", "phase_targeted": "GOAL-B return-vs-success", "metrics_after": {"hover_return": 314.9, "grasp_no_place_return": 673.7, "success_return": 965.3, "hover_gripper_box_w": 279.4, "hover_box_target_w": 0.0, "success_box_target_w": 445.1}, "verdict": "reward ORDERING well-specified (success 3.1x hover); BUT gripper_box(ungated,w4) gives hover 280/ep easy floor while box_target(gated by reached_box) is sparse+locked -> poorly-SHAPED for exploration => explains TD-MPC2 hover reward-hack"}
